{
  "period_from": "01.08.2026",
  "period_to": "14.08.2026",
  "party_a": {
    "name": "Продавец Тестов ТОО",
    "identifier": "104332181962"
  },
  "party_b": {
    "name": "Покупатель Тестов ТОО",
    "identifier": "001338908381"
  },
  "rows": [
    {
      "date": "14.08.2026",
      "doc": "50% & \"к\" #1 _t_ {б} \\б $5 ^верх ~тильда <уголки>",
      "a_debit": "1 000,00",
      "a_credit": "",
      "b_debit": "",
      "b_credit": "1 000,00"
    }
  ],
  "closing": {
    "a_says": "Задолженность в пользу Продавец Тестов ТОО на 14.08.2026 составляет 1 000,00 ₸",
    "b_says": "Задолженность в пользу Продавец Тестов ТОО на 14.08.2026 составляет 1 000,00 ₸"
  }
}
