{
  "period_from": "01.07.2026",
  "period_to": "31.07.2026",
  "party_a": {
    "name": "Cyber Capybara ТОО",
    "identifier": "104332181962",
    "address": "г. Алматы, ул. Абая, 150, оф. 12"
  },
  "party_b": {
    "name": "ТОО СтройИнвест",
    "identifier": "001338908381",
    "address": "г. Астана, пр. Мангилик Ел, 55"
  },
  "opening_balance": {
    "a_debit": "50 000,00",
    "a_credit": ""
  },
  "rows": [
    {
      "date": "05.07.2026",
      "doc": "Накладная № 10 от 05.07.2026",
      "a_debit": "30 000,00",
      "a_credit": "",
      "b_debit": "",
      "b_credit": "30 000,00"
    },
    {
      "date": "20.07.2026",
      "doc": "Платёжное поручение № 45",
      "a_debit": "",
      "a_credit": "40 000,00",
      "b_debit": "40 000,00",
      "b_credit": ""
    },
    {
      "date": "31.07.2026",
      "doc": "Накладная № 11 от 31.07.2026",
      "a_debit": "15 000,00",
      "a_credit": "",
      "b_debit": "",
      "b_credit": "15 000,00"
    }
  ],
  "closing": {
    "a_says": "Задолженность в пользу Cyber Capybara ТОО на 31.07.2026 составляет 55 000,00 ₸",
    "b_says": "Задолженность в пользу Cyber Capybara ТОО на 31.07.2026 составляет 55 000,00 ₸"
  }
}
